{
  "$schema": "https://json-schema.org/draft/2020-12/schema",
  "$id": "https://gm-instruments.example/schema/instrument_capability/v0.1",
  "title": "Instrument Capability Record",
  "description": "One record per addressable instrument/endstation. Design principle: separate WHAT you can learn (measurables) from HOW it is learned (techniques) from WHERE/WITH-WHAT (probe, resolution, sample constraints). The matchmaker resolves 'I want to measure X' -> measurables -> techniques -> instruments, then filters on constraints.",
  "type": "object",
  "required": ["id", "facility", "name", "instrument_class", "status", "techniques", "measurables", "provenance"],
  "properties": {
    "id": {
      "type": "string",
      "description": "Stable slug: <facility>-<local identifier>, e.g. 'als-8.3.2'"
    },
    "facility": {
      "type": "string",
      "description": "User facility short name, e.g. 'ALS', 'APS', 'NSLS-II', 'LCLS', 'SNS'"
    },
    "institution": { "type": "string", "description": "Host lab, e.g. 'LBNL'" },
    "name": { "type": "string", "description": "Human name, e.g. 'Hard X-Ray Micro-Tomography'" },
    "aliases": { "type": "array", "items": { "type": "string" }, "description": "Nicknames, endstation names, e.g. 'SIBYLS', 'MAESTRO'" },
    "instrument_class": {
      "type": "string",
      "enum": ["synchrotron-beamline", "fel-instrument", "neutron-instrument", "electron-microscope", "light-microscope", "mass-spectrometer", "nmr", "laser-facility", "accelerator-test-facility", "compute", "fabrication", "robotic-synthesis-platform", "robotic-processing-platform", "electrochemistry-platform", "mechanical-tester", "thermal-analyzer", "chromatography-system", "light-scattering-instrument", "scanning-probe-microscope", "spectrometer", "robotic-manipulator", "other"],
      "description": "Coarse class; extend as facility classes are added. v0.2 added autonomous-lab classes (PoLARIS)."
    },
    "status": {
      "type": "string",
      "enum": ["operational", "commissioning", "restricted", "not-operational", "closed", "planned", "unknown"],
      "description": "Operational status at retrieval time — selection must never route users to closed instruments"
    },
    "techniques": {
      "type": "array",
      "minItems": 1,
      "description": "HOW: named experimental techniques offered. Names should be mappable to PaNET terms where they exist.",
      "items": {
        "type": "object",
        "required": ["name"],
        "properties": {
          "name": { "type": "string", "description": "Canonical technique name, e.g. 'scanning transmission X-ray microscopy'" },
          "acronym": { "type": "string", "description": "e.g. 'STXM'" },
          "panet_id": { "type": "string", "description": "PaNET ontology IRI/curie once mapped, e.g. 'PaNET:PaNET01100'. Empty until ontology alignment pass." },
          "variants": { "type": "array", "items": { "type": "string" }, "description": "e.g. ['grazing-incidence', 'resonant', 'time-resolved']" }
        }
      }
    },
    "measurables": {
      "type": "array",
      "minItems": 1,
      "description": "WHAT: physical quantities/properties a user can learn. This is the primary matchmaking axis. Use lowercase noun phrases, e.g. 'elemental composition', '3d microstructure', 'electronic band structure', 'oxidation state', 'protein solution shape'.",
      "items": { "type": "string" }
    },
    "probe": {
      "type": "object",
      "description": "The physical probe delivered to the sample",
      "properties": {
        "type": { "type": "string", "enum": ["photon", "neutron", "electron", "ion", "positron", "muon", "field", "mechanical", "other"] },
        "energy_range_eV": {
          "type": "array", "items": { "type": "number" }, "minItems": 2, "maxItems": 2,
          "description": "[min, max] in eV. For neutrons use meV converted to eV; for IR this can be sub-eV."
        },
        "tunable": { "type": "boolean" },
        "polarization": { "type": "array", "items": { "type": "string" }, "description": "e.g. ['linear', 'circular', 'variable']" },
        "coherent": { "type": "boolean" },
        "pulsed": { "type": "boolean" },
        "flux_notes": { "type": "string", "description": "Free-text flux/brightness figures with units, verbatim from source" }
      }
    },
    "resolution": {
      "type": "object",
      "description": "Best demonstrated resolutions. Always include units in the value strings if not using the numeric fields.",
      "properties": {
        "spatial_m": { "type": "number", "description": "Best spatial resolution in meters (e.g. 2.5e-8 for 25 nm)" },
        "spatial_notes": { "type": "string" },
        "energy_resolving_power": { "type": "number", "description": "E/dE where quoted" },
        "energy_notes": { "type": "string" },
        "temporal_s": { "type": "number", "description": "Best time resolution in seconds" },
        "temporal_notes": { "type": "string" },
        "q_range_inv_angstrom": { "type": "array", "items": { "type": "number" }, "minItems": 2, "maxItems": 2, "description": "Momentum-transfer range for scattering instruments" }
      }
    },
    "sample_constraints": {
      "type": "object",
      "description": "What the instrument can accept — the feasibility filter",
      "properties": {
        "states": { "type": "array", "items": { "type": "string" }, "description": "e.g. ['solid', 'liquid', 'gas', 'frozen-hydrated', 'single crystal', 'powder', 'thin film', 'solution']" },
        "size_notes": { "type": "string", "description": "Sample size limits, verbatim with units" },
        "vacuum_required": { "type": "boolean" },
        "special_requirements": { "type": "array", "items": { "type": "string" }, "description": "e.g. ['radiation-hard', 'conductive surface', 'crystalline']" }
      }
    },
    "sample_environments": {
      "type": "array",
      "items": { "type": "string" },
      "description": "In-situ/operando capabilities, e.g. 'cryostat 4K', 'heating to 1000C', 'diamond anvil cell', 'electrochemical cell', 'controlled humidity', 'applied magnetic field 5T'"
    },
    "detectors": { "type": "array", "items": { "type": "string" }, "description": "Detector systems, verbatim names" },
    "data_products": {
      "type": "array",
      "description": "What the user takes home",
      "items": {
        "type": "object",
        "properties": {
          "type": { "type": "string", "description": "e.g. '3d tomogram', '2d diffraction pattern series', 'xas spectrum'" },
          "format": { "type": "string", "description": "e.g. 'HDF5', 'NeXus', 'TIFF stack', 'mzML'" }
        }
      }
    },
    "typical_experiment_duration": { "type": "string", "description": "e.g. '1-3 shifts per sample set' — free text" },
    "access": {
      "type": "object",
      "properties": {
        "mechanism": { "type": "string", "description": "e.g. 'general user proposal', 'rapid access', 'approved program', 'collaboration only'" },
        "proposal_system": { "type": "string", "description": "e.g. 'ALSHub'" },
        "proposal_url": { "type": "string" },
        "cost_model": { "type": "string", "description": "e.g. 'no-cost for publishable research; proprietary rates apply'" }
      }
    },
    "throughput": {
      "type": "object",
      "description": "v0.2 (from autonomous-lab catalogs): capacity data that beamline catalogs rarely state but campaign planning requires",
      "properties": {
        "samples_per_year": { "type": "string", "description": "Estimated annual throughput, verbatim (e.g. '~400-4,000 samples/year')" },
        "availability": { "type": "string", "description": "Operating schedule, e.g. '~20 hrs/day, 4 days/week' or 'by allocated beamtime'" }
      }
    },
    "automation": {
      "type": "object",
      "description": "v0.2: HOW an agent can drive this instrument - the operation-capability block. This is the selection-layer's view of what PULSE-class operation needs per instrument.",
      "properties": {
        "control_interface": { "type": "string", "description": "e.g. 'Python API', 'REST API', 'vendor GUI loosely integrated with Python', 'EPICS', 'ROS/LabVIEW', 'MHS driver (Model Hardware Standard, research preview 2026)'" },
        "autosampler": { "type": "string", "description": "Autosampler capacity if any, e.g. '50-position'" },
        "robotic_sample_exchange": { "type": "string", "description": "e.g. 'UR10e central rail (planned FY26)', 'UR3 arm (existing)'" },
        "orchestration": { "type": "string", "description": "Workflow system the instrument is or will be a node of, e.g. 'MADSci node', 'Bluesky'" }
      }
    },
    "campaign_roles": {
      "type": "array",
      "items": { "type": "string", "enum": ["synthesis", "processing", "characterization", "sample-transport", "fabrication"] },
      "description": "v0.2: role(s) in a closed-loop campaign. Selection now spans MAKE (synthesis/processing) as well as MEASURE (characterization)."
    },
    "integration_dependencies": {
      "type": "array",
      "items": { "type": "string" },
      "description": "v0.2: what must exist before full autonomous operation, e.g. 'UR10e installation (FY26)'"
    },
    "contacts": {
      "type": "array",
      "items": { "type": "object", "properties": { "name": { "type": "string" }, "email": { "type": "string" }, "role": { "type": "string" } } }
    },
    "urls": { "type": "array", "items": { "type": "string" }, "description": "Beamline homepage and key documentation pages" },
    "demonstrated_applications": {
      "type": "array",
      "items": { "type": "string" },
      "description": "Short phrases for what has actually been measured here (from highlights/publications) — demonstrated performance beats spec sheets for matchmaking"
    },
    "provenance": {
      "type": "array",
      "minItems": 1,
      "items": {
        "type": "object",
        "required": ["source_url", "retrieved"],
        "properties": {
          "source_url": { "type": "string" },
          "retrieved": { "type": "string", "format": "date" },
          "notes": { "type": "string", "description": "Which fields came from this source; extraction method" }
        }
      }
    },
    "record_depth": {
      "type": "string",
      "enum": ["directory", "deep"],
      "description": "'directory' = breadth pass from facility directory table only; 'deep' = individual page extraction"
    }
  }
}
