[
{
  "id": "aps-2-id-e",
  "facility": "APS",
  "institution": "ANL",
  "name": "2-ID-E X-ray Fluorescence Microprobe",
  "aliases": ["2-ID-E Microprobe", "APS-U 2-ID Microprobe", "XSD Microscopy 2-ID-E"],
  "instrument_class": "synchrotron-beamline",
  "status": "operational",
  "record_depth": "deep",
  "techniques": [
    {"name": "X-ray fluorescence microscopy", "acronym": "XFM", "panet_id": "", "variants": ["scanning microprobe", "fly-scanning"]},
    {"name": "X-ray fluorescence tomography", "acronym": "XRF-CT", "panet_id": ""},
    {"name": "X-ray fluorescence laminography", "panet_id": ""},
    {"name": "micro X-ray absorption near-edge structure spectroscopy", "acronym": "micro-XANES", "panet_id": "", "variants": ["fluorescence-detected"]},
    {"name": "ptychography", "panet_id": "", "variants": ["post-APS-U capability per 2022 endstation design paper"]},
    {"name": "micro small-angle X-ray scattering", "acronym": "micro-SAXS", "panet_id": "", "variants": ["post-APS-U capability per 2022 endstation design paper"]}
  ],
  "measurables": [
    "trace element distribution",
    "elemental composition maps at sub-micron scale",
    "quantitative elemental content of single cells (part-per-million detection sensitivity)",
    "3d elemental distribution via xrf tomography and laminography",
    "oxidation state / metal speciation (micro-XANES)",
    "nanoscale electron-density structure (ptychography, post-APS-U)",
    "local nanostructure via micro-SAXS (post-APS-U)"
  ],
  "probe": {
    "type": "photon",
    "energy_range_eV": [5000, 20000],
    "tunable": true,
    "coherent": true,
    "flux_notes": "APS beamline directory (retrieved 2026-08-27): flux 4x10^9 ph/s at 10 keV, Kohzu Si(111) monochromator, energy range 5-20 keV; zone-plate configurations: near-field stack of two zone plates (D=160 um) gives 5x10^8 ph/s at 10 keV, single zone plate (D=320 um) gives ~10x flux. APS-U 2-ID Microprobe endstation (Davis et al. 2022): >10^13 ph/s across 7-20 keV with KB mirror focusing and new combined DCM/DMM monochromator (mono or pink beam)."
  },
  "resolution": {
    "spatial_m": 3e-7,
    "spatial_notes": "Zone-plate microprobe (beamline directory): focused beam 0.5 um x 0.4 um; near-field stacked zone plates give 0.4 um x 0.3 um probe; single zone plate 0.6 um x 0.4 um at ~10x flux. APS-U 2-ID Microprobe endstation design (Davis et al. 2022, installed in station 2-ID-E): JTEC Kirkpatrick-Baez mirrors, achromatic over 7-20 keV, 50 nm spot with asymmetric focusing, 10 um depth of focus, 50 mm working distance.",
    "energy_resolving_power": 7100,
    "energy_notes": "Directory lists monochromator energy resolution dE/E = 1.4x10^-4 (Kohzu Si(111))."
  },
  "sample_constraints": {
    "states": ["solid", "thin sections", "whole cells (dried, fixed, or embedded)", "thin film"],
    "size_notes": "Optimized for many-micrometer-thick specimens (XSD-MIC 2-ID-E page). APS-U Microprobe endstation accommodates samples up to 10 x 10 mm at 50 mm working distance; sample holder payload up to 2 kg; XYZ scan travel >=10 mm, fly-scanning at >=25 mm/s with unlimited rotation for tomography (Davis et al. 2022).",
    "vacuum_required": false
  },
  "sample_environments": [
    "environmental specimen chamber optimized for bio-medical and environmental specimens, with kinematic specimen mounting correlated to a Leica DMXRE epi-fluorescence microscope (beamline directory)",
    "inert helium sample enclosure (APS-U endstation)",
    "controlled flow of fluids (APS-U endstation)",
    "electrical biasing (APS-U endstation)",
    "sample heating and cooling, including a cryo-cooled 2D sample holder (APS-U endstation design)"
  ],
  "detectors": [
    "Hitachi (SII) Vortex ME4 4-element silicon drift detector for XRF and spectroscopy",
    "Dectris Eiger2-500K photon-counting area detector for ptychography, laminography and micro-SAXS (APS-U endstation, 700-2000 mm from sample with He flight tube)"
  ],
  "data_products": [
    {"type": "2d quantitative elemental maps with full XRF spectrum per pixel, fitted with APS MAPS / XRF-Maps software"},
    {"type": "3d xrf tomogram"},
    {"type": "xrf laminogram"},
    {"type": "micro-XANES spectra / speciation maps"},
    {"type": "ptychographic phase images (post-APS-U)"},
    {"type": "micro-SAXS patterns (post-APS-U)"}
  ],
  "access": {"mechanism": "general user proposal", "proposal_system": "APS user proposal system (APS User Portal)", "proposal_url": "https://beam.aps.anl.gov"},
  "contacts": [
    {"name": "Olga Antipova", "role": "beamline contact, 2D/3D XFM and XRF laminography"},
    {"name": "Barry Lai", "email": "blai@anl.gov", "role": "beamline contact, 2D/3D XFM; physicist, X-ray Science Division Microscopy group"}
  ],
  "urls": ["https://www.aps.anl.gov/Beamlines/Beamline-Directory/61", "https://www.aps.anl.gov/Microscopy/Beamlines/2-ID-E", "https://beam.aps.anl.gov/pls/apsweb/beamline_display_pkg.display_beamline?p_beamline_num_c=61"],
  "demonstrated_applications": [
    "quantitative zinc mapping in single mouse oocytes/eggs revealing ~8000 zinc-loaded vesicles behind fertilization-induced 'zinc sparks' (Que et al., Nature Chemistry 2015; XFM at APS 2-ID-E and 21-ID-D)",
    "quantification of trace elements (Si, Mn, Fe, Ni, Zn) in individual aquatic protist and plankton cells, 3 to >50 um, for ocean biogeochemistry (Twining et al., Analytical Chemistry 2003)",
    "elemental mapping of trace metals in hepatocellular carcinoma research-model tissues with Vortex ME4 SDD and MAPS peak deconvolution (Frontiers in Public Health 2021)",
    "xrf tomography of composite samples at sub-micron resolution (Microscopy and Microanalysis conference paper)",
    "post-APS-U target applications stated in endstation paper: 3D microelectronics defect metrology, photovoltaic materials, aerosol particles, exogenous and endogenous metal distribution in cells and tissues (Davis et al. 2022)"
  ],
  "provenance": [
    {"source_url": "https://www.aps.anl.gov/Beamlines/Beamline-Directory/61", "retrieved": "2026-08-27", "notes": "APS beamline directory entry '2-ID-E Microprobe'. Direct fetch blocked (HTTP 403, Cloudflare); content extracted from web-search snippets. Source of: name, status (listed operational/accepting users), Kohzu Si(111), 5-20 keV, dE/E 1.4e-4, flux 4e9 ph/s @10 keV, focused beam 0.5x0.4 um, zone-plate configurations, XRF tomography and laminography, environmental specimen chamber with Leica DMXRE correlation, contacts, MAPS/XRF-Maps software."},
    {"source_url": "https://www.aps.anl.gov/Microscopy/Beamlines/2-ID-E", "retrieved": "2026-08-27", "notes": "XSD Microscopy group 2-ID-E page (403 on direct fetch; via search snippets). Source of side-branch geometry and sensitivity claim: 'trace elements in many-micrometer-thick specimens with sub-micron spatial resolution, part-per-million detection sensitivity, and tomographic datasets'."},
    {"source_url": "https://iopscience.iop.org/article/10.1088/1742-6596/2380/1/012044", "retrieved": "2026-08-27", "notes": "Davis B, Antipova O, Preissner C, et al., 'Enhanced microprobe endstation for high-throughput and versatile sample analysis at APS 2-ID', J. Phys.: Conf. Ser. 2380 (2022) 012044 (open access; full PDF read). Confirms APS-U 2-ID Microprobe installed in station 2-ID-E: techniques, 7-20 keV, >1e13 ph/s, JTEC KB mirrors 50 nm spot, DCM/DMM with pink-beam option, He sample box with fluid flow/biasing/heating-cooling, sample holders, >=25 mm/s fly-scanning, Eiger2-500K and Vortex ME4, target applications."},
    {"source_url": "https://www.frontiersin.org/journals/public-health/articles/10.3389/fpubh.2021.711506/full", "retrieved": "2026-08-27", "notes": "Frontiers in Public Health 2021 HCC paper: confirms elemental mapping at sector 2, station 2-ID-E with Vortex ME4 and MAPS."},
    {"source_url": "https://pubs.acs.org/doi/10.1021/ac034227z", "retrieved": "2026-08-27", "notes": "Twining et al., Anal. Chem. 2003 (via search snippets): 2-ID-E side-branch microprobe, single-cell trace-element quantification."},
    {"source_url": "https://www.aps.anl.gov/APS-Science-Highlight/2018/stunning-zinc-fireworks-when-egg-meets-sperm", "retrieved": "2026-08-27", "notes": "APS science highlight for Que et al., Nature Chemistry 2015 via search snippets: zinc mapping in 2D and 3D in mouse eggs at 2-ID-E and 21-ID-D."},
    {"source_url": "https://osti.gov/biblio/1239606", "retrieved": "2026-08-27", "notes": "OSTI record corroborating the zinc-spark application."},
    {"source_url": "https://www.cambridge.org/core/journals/microscopy-and-microanalysis/article/developments-of-xray-fluorescence-tomography-at-2ide-at-aps-for-studies-of-composite-samples/001AD149C273E9840B323A2FEF5E4166", "retrieved": "2026-08-27", "notes": "M&M conference paper corroborating XRF tomography capability."},
    {"source_url": "https://www.aps.anl.gov/Users-Information/About-Proposals/Proposal-Types", "retrieved": "2026-08-27", "notes": "APS proposal types page (403; via search results). Basis for access mechanism = APS general user proposal via beam.aps.anl.gov. Cost model omitted (not verified)."},
    {"source_url": "https://proceedings.jacow.org/medsi2025/institute/blai-anl-gov-barry-lai/index.html", "retrieved": "2026-08-27", "notes": "MEDSI 2025 author page: Barry Lai contact email. Status 'operational' rests on current APS directory snippet listing plus the Davis et al. 2022 rebuilt-endstation paper; no direct 2025-2026 publication at 2-ID-E verified during this retrieval because aps.anl.gov blocks automated access. PtychoProbe (33-ID) and ISN (19-ID) are separate feature beamlines and did not supersede 2-ID-E."}
  ]
},
{
  "id": "aps-13-id-e",
  "facility": "APS",
  "institution": "ANL (GSECARS/UChicago)",
  "name": "13-ID-E GSECARS X-ray Microprobe",
  "aliases": ["GSECARS microprobe", "Sector 13 X-ray Microprobe"],
  "instrument_class": "synchrotron-beamline",
  "status": "operational",
  "record_depth": "deep",
  "techniques": [